{
  "dossier_id": "d10",
  "base_resume_path": "resume.txt",
  "evidence": [
    {
      "id": "ev-001",
      "owner": "exp-1",
      "kind": "title",
      "text": "Build Engineer"
    },
    {
      "id": "ev-002",
      "owner": "exp-1",
      "kind": "organization",
      "text": "Luravexa Cloud"
    },
    {
      "id": "ev-003",
      "owner": "exp-1",
      "kind": "date",
      "text": "Jul 2022 - Jun 2023"
    },
    {
      "id": "ev-004",
      "owner": "exp-1",
      "kind": "tool",
      "text": "Terraform"
    },
    {
      "id": "ev-005",
      "owner": "exp-1",
      "kind": "metric",
      "text": "20%"
    },
    {
      "id": "ev-006",
      "owner": "exp-1",
      "kind": "outcome",
      "text": "reduced staging setup time"
    },
    {
      "id": "ev-007",
      "owner": "exp-1",
      "kind": "tool",
      "text": "Bash"
    },
    {
      "id": "ev-008",
      "owner": "exp-1",
      "kind": "outcome",
      "text": "diagnosed image build failures"
    },
    {
      "id": "ev-009",
      "owner": "exp-2",
      "kind": "title",
      "text": "Site Reliability Engineer"
    },
    {
      "id": "ev-010",
      "owner": "exp-2",
      "kind": "organization",
      "text": "Mavirell Tools"
    },
    {
      "id": "ev-011",
      "owner": "exp-2",
      "kind": "date",
      "text": "Jul 2023 - Present"
    },
    {
      "id": "ev-012",
      "owner": "exp-2",
      "kind": "tool",
      "text": "Docker"
    },
    {
      "id": "ev-013",
      "owner": "exp-2",
      "kind": "tool",
      "text": "GitHub Actions"
    },
    {
      "id": "ev-014",
      "owner": "exp-2",
      "kind": "outcome",
      "text": "maintained release images"
    },
    {
      "id": "ev-015",
      "owner": "exp-2",
      "kind": "tool",
      "text": "Prometheus"
    },
    {
      "id": "ev-016",
      "owner": "exp-2",
      "kind": "outcome",
      "text": "located deployment faults"
    },
    {
      "id": "ev-017",
      "owner": "project-1",
      "kind": "outcome",
      "text": "documented service restarts"
    },
    {
      "id": "ev-018",
      "owner": "education",
      "kind": "organization",
      "text": "Example Technical Institute"
    },
    {
      "id": "ev-019",
      "owner": "education",
      "kind": "credential",
      "text": "B.S. in Computer Engineering"
    },
    {
      "id": "ev-020",
      "owner": "education",
      "kind": "date",
      "text": "Aug 2016 - May 2020"
    },
    {
      "id": "ev-021",
      "owner": "candidate",
      "kind": "tool",
      "text": "Terraform"
    },
    {
      "id": "ev-022",
      "owner": "candidate",
      "kind": "tool",
      "text": "Docker"
    },
    {
      "id": "ev-023",
      "owner": "candidate",
      "kind": "tool",
      "text": "GitHub Actions"
    },
    {
      "id": "ev-024",
      "owner": "candidate",
      "kind": "tool",
      "text": "Prometheus"
    },
    {
      "id": "ev-025",
      "owner": "candidate",
      "kind": "tool",
      "text": "Bash"
    },
    {
      "id": "ev-026",
      "owner": "exp-1",
      "kind": "tool",
      "text": "Grafana"
    },
    {
      "id": "ev-027",
      "owner": "exp-1",
      "kind": "tool",
      "text": "Ansible"
    },
    {
      "id": "ev-028",
      "owner": "exp-1",
      "kind": "outcome",
      "text": "created rollback checklists"
    },
    {
      "id": "ev-029",
      "owner": "exp-1",
      "kind": "outcome",
      "text": "reviewed capacity alarms"
    },
    {
      "id": "ev-030",
      "owner": "exp-1",
      "kind": "outcome",
      "text": "tested restore procedures"
    },
    {
      "id": "ev-031",
      "owner": "exp-1",
      "kind": "outcome",
      "text": "prepared on-call handoffs"
    },
    {
      "id": "ev-032",
      "owner": "exp-1",
      "kind": "outcome",
      "text": "reduced noisy alerts"
    },
    {
      "id": "ev-033",
      "owner": "exp-1",
      "kind": "outcome",
      "text": "documented deployment dependencies"
    }
  ],
  "notes": "Entirely synthetic devops/sre candidate. Evidence items after the 25 resume facts are verified but omitted from the base resume."
}
