{
  "dossier_id": "d08",
  "base_resume_path": "resume.txt",
  "evidence": [
    {
      "id": "ev-001",
      "owner": "exp-1",
      "kind": "title",
      "text": "QA Engineer"
    },
    {
      "id": "ev-002",
      "owner": "exp-1",
      "kind": "organization",
      "text": "Jelvarune Quality"
    },
    {
      "id": "ev-003",
      "owner": "exp-1",
      "kind": "date",
      "text": "Aug 2022 - Present"
    },
    {
      "id": "ev-004",
      "owner": "exp-1",
      "kind": "tool",
      "text": "pytest"
    },
    {
      "id": "ev-005",
      "owner": "exp-1",
      "kind": "outcome",
      "text": "checked portal releases"
    },
    {
      "id": "ev-006",
      "owner": "exp-1",
      "kind": "tool",
      "text": "Selenium"
    },
    {
      "id": "ev-007",
      "owner": "exp-1",
      "kind": "outcome",
      "text": "reproduced sign-in failures"
    },
    {
      "id": "ev-008",
      "owner": "project-1",
      "kind": "tool",
      "text": "Python"
    },
    {
      "id": "ev-009",
      "owner": "project-1",
      "kind": "outcome",
      "text": "listed regression paths"
    },
    {
      "id": "ev-010",
      "owner": "education",
      "kind": "organization",
      "text": "Example Computing College"
    },
    {
      "id": "ev-011",
      "owner": "education",
      "kind": "credential",
      "text": "B.S. in Information Systems"
    },
    {
      "id": "ev-012",
      "owner": "education",
      "kind": "date",
      "text": "Aug 2017 - May 2021"
    },
    {
      "id": "ev-013",
      "owner": "candidate",
      "kind": "tool",
      "text": "Python"
    },
    {
      "id": "ev-014",
      "owner": "candidate",
      "kind": "tool",
      "text": "pytest"
    },
    {
      "id": "ev-015",
      "owner": "candidate",
      "kind": "tool",
      "text": "Selenium"
    },
    {
      "id": "ev-016",
      "owner": "candidate",
      "kind": "tool",
      "text": "Git"
    },
    {
      "id": "ev-017",
      "owner": "exp-1",
      "kind": "tool",
      "text": "Playwright"
    },
    {
      "id": "ev-018",
      "owner": "exp-1",
      "kind": "tool",
      "text": "Postman"
    },
    {
      "id": "ev-019",
      "owner": "exp-1",
      "kind": "outcome",
      "text": "reviewed bug reproduction steps"
    },
    {
      "id": "ev-020",
      "owner": "exp-1",
      "kind": "outcome",
      "text": "documented browser coverage"
    },
    {
      "id": "ev-021",
      "owner": "exp-1",
      "kind": "outcome",
      "text": "created test data guidelines"
    }
  ],
  "notes": "Entirely synthetic qa/sdet candidate. Evidence items after the 16 resume facts are verified but omitted from the base resume."
}
